{
  "$schema": "https://json-schema.org/draft/2020-12/schema",
  "$id": "https://daily.local/piano/exercise-v1.schema.json",
  "title": "Daily piano exercise v1",
  "type": "object",
  "properties": {
    "schemaVersion": {
      "const": 1
    },
    "id": {
      "type": "string",
      "minLength": 1,
      "maxLength": 200
    },
    "title": {
      "type": "string",
      "minLength": 1
    },
    "instructions": {
      "type": "string",
      "minLength": 1
    },
    "ticksPerQuarter": {
      "type": "integer",
      "minimum": 1,
      "maximum": 15360,
      "default": 960
    },
    "defaultVariantId": {
      "type": "string",
      "minLength": 1,
      "maxLength": 200
    },
    "tracks": {
      "type": "array",
      "items": {
        "$ref": "#/$defs/Track"
      },
      "minItems": 1
    },
    "variants": {
      "type": "array",
      "items": {
        "$ref": "#/$defs/Variant"
      },
      "minItems": 1
    }
  },
  "required": [
    "schemaVersion",
    "id",
    "title",
    "defaultVariantId",
    "tracks",
    "variants"
  ],
  "additionalProperties": false,
  "$defs": {
    "Track": {
      "type": "object",
      "properties": {
        "id": {
          "type": "string",
          "minLength": 1,
          "maxLength": 200
        },
        "name": {
          "type": "string",
          "minLength": 1
        }
      },
      "required": [
        "id",
        "name"
      ],
      "additionalProperties": false
    },
    "Tempo": {
      "type": "object",
      "properties": {
        "tick": {
          "type": "integer",
          "minimum": 0,
          "maximum": 9007199254740991
        },
        "quarterBpm": {
          "type": "number",
          "exclusiveMinimum": 0,
          "maximum": 1000
        }
      },
      "required": [
        "tick",
        "quarterBpm"
      ],
      "additionalProperties": false
    },
    "Meter": {
      "type": "object",
      "properties": {
        "tick": {
          "type": "integer",
          "minimum": 0,
          "maximum": 9007199254740991
        },
        "numerator": {
          "type": "integer",
          "minimum": 1,
          "maximum": 32
        },
        "denominator": {
          "enum": [
            1,
            2,
            4,
            8,
            16,
            32
          ]
        }
      },
      "required": [
        "tick",
        "numerator",
        "denominator"
      ],
      "additionalProperties": false
    },
    "Measure": {
      "type": "object",
      "properties": {
        "id": {
          "type": "string",
          "minLength": 1,
          "maxLength": 200
        },
        "label": {
          "type": "string",
          "minLength": 1
        },
        "startTick": {
          "type": "integer",
          "minimum": 0,
          "maximum": 9007199254740991
        },
        "endTick": {
          "type": "integer",
          "minimum": 1,
          "maximum": 9007199254740991
        },
        "incomplete": {
          "type": "boolean"
        }
      },
      "required": [
        "id",
        "label",
        "startTick",
        "endTick"
      ],
      "additionalProperties": false
    },
    "Subdivision": {
      "type": "object",
      "properties": {
        "id": {
          "type": "string",
          "minLength": 1,
          "maxLength": 200
        },
        "startTick": {
          "type": "integer",
          "minimum": 0,
          "maximum": 9007199254740991
        },
        "endTick": {
          "type": "integer",
          "minimum": 1,
          "maximum": 9007199254740991
        },
        "stepTicks": {
          "type": "integer",
          "minimum": 1,
          "maximum": 9007199254740991
        },
        "labels": {
          "type": "array",
          "items": {
            "type": "string",
            "minLength": 1
          },
          "minItems": 1
        }
      },
      "required": [
        "id",
        "startTick",
        "endTick",
        "stepTicks",
        "labels"
      ],
      "additionalProperties": false
    },
    "Note": {
      "type": "object",
      "properties": {
        "id": {
          "type": "string",
          "minLength": 1,
          "maxLength": 200
        },
        "trackId": {
          "type": "string",
          "minLength": 1,
          "maxLength": 200
        },
        "pitch": {
          "type": "integer",
          "minimum": 0,
          "maximum": 127
        },
        "startTick": {
          "type": "integer",
          "minimum": 0,
          "maximum": 9007199254740991
        },
        "durationTicks": {
          "type": "integer",
          "minimum": 1,
          "maximum": 9007199254740991
        },
        "velocity": {
          "type": "integer",
          "minimum": 1,
          "maximum": 127
        },
        "accent": {
          "type": "boolean"
        },
        "fingering": {
          "type": "string",
          "minLength": 1
        },
        "voice": {
          "type": "string",
          "minLength": 1
        },
        "pitchSpelling": {
          "type": "string",
          "minLength": 1
        },
        "notation": {
          "type": "object"
        }
      },
      "required": [
        "id",
        "trackId",
        "pitch",
        "startTick",
        "durationTicks",
        "velocity",
        "accent"
      ],
      "additionalProperties": false
    },
    "Pedal": {
      "type": "object",
      "properties": {
        "id": {
          "type": "string",
          "minLength": 1,
          "maxLength": 200
        },
        "trackId": {
          "type": "string",
          "minLength": 1,
          "maxLength": 200
        },
        "tick": {
          "type": "integer",
          "minimum": 0,
          "maximum": 9007199254740991
        },
        "down": {
          "type": "boolean"
        }
      },
      "required": [
        "id",
        "trackId",
        "tick",
        "down"
      ],
      "additionalProperties": false
    },
    "ScoreReference": {
      "type": "object",
      "properties": {
        "id": {
          "type": "string",
          "minLength": 1,
          "maxLength": 200
        },
        "attachmentId": {
          "type": "string",
          "minLength": 1,
          "maxLength": 200
        },
        "measureId": {
          "type": "string",
          "minLength": 1,
          "maxLength": 200
        },
        "page": {
          "type": "integer",
          "minimum": 1,
          "maximum": 9007199254740991
        },
        "notation": {
          "type": "object"
        }
      },
      "required": [
        "id",
        "attachmentId"
      ],
      "additionalProperties": false
    },
    "Variant": {
      "type": "object",
      "properties": {
        "id": {
          "type": "string",
          "minLength": 1,
          "maxLength": 200
        },
        "name": {
          "type": "string",
          "minLength": 1
        },
        "lengthTicks": {
          "type": "integer",
          "minimum": 1,
          "maximum": 9007199254740991
        },
        "tempoMap": {
          "type": "array",
          "items": {
            "$ref": "#/$defs/Tempo"
          },
          "minItems": 1
        },
        "timeSignatureMap": {
          "type": "array",
          "items": {
            "$ref": "#/$defs/Meter"
          },
          "minItems": 1
        },
        "measures": {
          "type": "array",
          "items": {
            "$ref": "#/$defs/Measure"
          },
          "minItems": 1
        },
        "subdivisionRegions": {
          "type": "array",
          "items": {
            "$ref": "#/$defs/Subdivision"
          },
          "minItems": 0
        },
        "notes": {
          "type": "array",
          "items": {
            "$ref": "#/$defs/Note"
          },
          "minItems": 0
        },
        "pedalEvents": {
          "type": "array",
          "items": {
            "$ref": "#/$defs/Pedal"
          },
          "minItems": 0
        },
        "scoreReferences": {
          "type": "array",
          "items": {
            "$ref": "#/$defs/ScoreReference"
          },
          "minItems": 0
        },
        "notation": {
          "type": "object"
        }
      },
      "required": [
        "id",
        "name",
        "lengthTicks",
        "tempoMap",
        "timeSignatureMap",
        "measures",
        "notes"
      ],
      "additionalProperties": false
    }
  }
}
