{
  "schemaVersion": 1,
  "id": "timing-test",
  "title": "Timing test: chords, octaves and triplets",
  "instructions": "Adapted from your pasted fragment. Complete note events are preserved. The incomplete opening note is omitted; the header assumes 120 quarter notes/min and two 4/4 measures.",
  "ticksPerQuarter": 960,
  "defaultVariantId": "written",
  "tracks": [
    {
      "id": "left",
      "name": "Left hand"
    },
    {
      "id": "right",
      "name": "Right hand"
    }
  ],
  "variants": [
    {
      "id": "written",
      "name": "As supplied (adapted header)",
      "lengthTicks": 7680,
      "tempoMap": [
        {
          "tick": 0,
          "quarterBpm": 120
        }
      ],
      "timeSignatureMap": [
        {
          "tick": 0,
          "numerator": 4,
          "denominator": 4
        }
      ],
      "measures": [
        {
          "id": "m1",
          "label": "1",
          "startTick": 0,
          "endTick": 3840
        },
        {
          "id": "m2",
          "label": "2",
          "startTick": 3840,
          "endTick": 7680
        }
      ],
      "subdivisionRegions": [
        {
          "id": "triplets",
          "startTick": 3840,
          "endTick": 4800,
          "stepTicks": 320,
          "labels": [
            "1",
            "trip",
            "LET"
          ]
        }
      ],
      "notes": [
        {
          "id": "timing-test-n5",
          "trackId": "right",
          "pitch": 60,
          "startTick": 960,
          "durationTicks": 960,
          "velocity": 68,
          "accent": false
        },
        {
          "id": "timing-test-n6",
          "trackId": "right",
          "pitch": 64,
          "startTick": 960,
          "durationTicks": 960,
          "velocity": 68,
          "accent": false
        },
        {
          "id": "timing-test-n7",
          "trackId": "right",
          "pitch": 67,
          "startTick": 960,
          "durationTicks": 960,
          "velocity": 68,
          "accent": false
        },
        {
          "id": "timing-test-n17",
          "trackId": "left",
          "pitch": 48,
          "startTick": 2880,
          "durationTicks": 960,
          "velocity": 52,
          "accent": false
        },
        {
          "id": "timing-test-n8",
          "trackId": "right",
          "pitch": 60,
          "startTick": 2880,
          "durationTicks": 960,
          "velocity": 68,
          "accent": false
        },
        {
          "id": "timing-test-n9",
          "trackId": "right",
          "pitch": 72,
          "startTick": 2880,
          "durationTicks": 960,
          "velocity": 68,
          "accent": false
        },
        {
          "id": "timing-test-n18",
          "trackId": "left",
          "pitch": 48,
          "startTick": 3840,
          "durationTicks": 960,
          "velocity": 52,
          "accent": false
        },
        {
          "id": "timing-test-n10",
          "trackId": "right",
          "pitch": 60,
          "startTick": 3840,
          "durationTicks": 320,
          "velocity": 68,
          "accent": false
        },
        {
          "id": "timing-test-n11",
          "trackId": "right",
          "pitch": 62,
          "startTick": 4160,
          "durationTicks": 320,
          "velocity": 68,
          "accent": false
        },
        {
          "id": "timing-test-n12",
          "trackId": "right",
          "pitch": 64,
          "startTick": 4480,
          "durationTicks": 320,
          "velocity": 96,
          "accent": true
        },
        {
          "id": "timing-test-n19",
          "trackId": "left",
          "pitch": 48,
          "startTick": 4800,
          "durationTicks": 960,
          "velocity": 52,
          "accent": false
        },
        {
          "id": "timing-test-n13",
          "trackId": "right",
          "pitch": 65,
          "startTick": 4800,
          "durationTicks": 960,
          "velocity": 68,
          "accent": false
        },
        {
          "id": "timing-test-n14",
          "trackId": "right",
          "pitch": 67,
          "startTick": 6720,
          "durationTicks": 480,
          "velocity": 68,
          "accent": false
        }
      ]
    }
  ]
}
