{
  "schemaVersion": 1,
  "id": "documentation-triplets",
  "title": "Two hands: triplets and silence",
  "instructions": "Keep the triplets even; observe the written tempo change.",
  "ticksPerQuarter": 960,
  "defaultVariantId": "written",
  "tracks": [
    {
      "id": "lh",
      "name": "Left hand"
    },
    {
      "id": "rh",
      "name": "Right hand"
    }
  ],
  "variants": [
    {
      "id": "written",
      "name": "As written",
      "lengthTicks": 7680,
      "tempoMap": [
        {
          "tick": 0,
          "quarterBpm": 120
        },
        {
          "tick": 3840,
          "quarterBpm": 100
        }
      ],
      "timeSignatureMap": [
        {
          "tick": 0,
          "numerator": 4,
          "denominator": 4
        }
      ],
      "measures": [
        {
          "id": "m1",
          "label": "1",
          "startTick": 0,
          "endTick": 3840
        },
        {
          "id": "m2",
          "label": "2",
          "startTick": 3840,
          "endTick": 7680
        }
      ],
      "subdivisionRegions": [
        {
          "id": "triplets",
          "startTick": 0,
          "endTick": 960,
          "stepTicks": 320,
          "labels": [
            "1",
            "trip",
            "LET"
          ]
        }
      ],
      "notes": [
        {
          "id": "n1",
          "trackId": "lh",
          "pitch": 48,
          "startTick": 0,
          "durationTicks": 1920,
          "velocity": 72,
          "accent": false
        },
        {
          "id": "n2",
          "trackId": "lh",
          "pitch": 60,
          "startTick": 0,
          "durationTicks": 1920,
          "velocity": 72,
          "accent": false
        },
        {
          "id": "n3",
          "trackId": "rh",
          "pitch": 64,
          "startTick": 0,
          "durationTicks": 320,
          "velocity": 72,
          "accent": false
        },
        {
          "id": "n4",
          "trackId": "rh",
          "pitch": 67,
          "startTick": 320,
          "durationTicks": 320,
          "velocity": 72,
          "accent": false
        },
        {
          "id": "n5",
          "trackId": "rh",
          "pitch": 72,
          "startTick": 640,
          "durationTicks": 320,
          "velocity": 72,
          "accent": true
        },
        {
          "id": "n6",
          "trackId": "rh",
          "pitch": 67,
          "startTick": 1920,
          "durationTicks": 960,
          "velocity": 72,
          "accent": false
        },
        {
          "id": "n7",
          "trackId": "lh",
          "pitch": 43,
          "startTick": 3840,
          "durationTicks": 1920,
          "velocity": 72,
          "accent": true
        },
        {
          "id": "n8",
          "trackId": "rh",
          "pitch": 62,
          "startTick": 3840,
          "durationTicks": 240,
          "velocity": 72,
          "accent": false
        },
        {
          "id": "n9",
          "trackId": "rh",
          "pitch": 65,
          "startTick": 4080,
          "durationTicks": 240,
          "velocity": 72,
          "accent": false
        },
        {
          "id": "n10",
          "trackId": "rh",
          "pitch": 69,
          "startTick": 4320,
          "durationTicks": 480,
          "velocity": 72,
          "accent": true
        }
      ],
      "pedalEvents": [
        {
          "id": "pd",
          "trackId": "lh",
          "tick": 0,
          "down": true
        },
        {
          "id": "pu",
          "trackId": "lh",
          "tick": 1920,
          "down": false
        }
      ]
    }
  ]
}
